{
  "id": "terrain.cp-01",
  "name": "Combat Patrol Default Layout",
  "board": { "w": 44, "h": 30 },
  "pieces": [
    {
      "id": "ruin-l1",
      "kind": "ruin",
      "pos": { "x": 0, "z": 0 },
      "rot": 0,
      "footprint": [
        { "x": -9, "z": 1 },
        { "x": -3, "z": 1 },
        { "x": -3, "z": 3 },
        { "x": -7, "z": 3 },
        { "x": -7, "z": 7 },
        { "x": -9, "z": 7 }
      ],
      "height": 6,
      "traits": ["obscuring", "cover", "scalable"],
      "walls": [
        { "a": { "x": -9, "z": 1 }, "b": { "x": -3, "z": 1 }, "height": 6 },
        { "a": { "x": -3, "z": 1 }, "b": { "x": -3, "z": 3 }, "height": 6 },
        { "a": { "x": -3, "z": 3 }, "b": { "x": -7, "z": 3 }, "height": 6 },
        { "a": { "x": -7, "z": 3 }, "b": { "x": -7, "z": 7 }, "height": 6 },
        { "a": { "x": -7, "z": 7 }, "b": { "x": -9, "z": 7 }, "height": 6 },
        { "a": { "x": -9, "z": 7 }, "b": { "x": -9, "z": 1 }, "height": 6 }
      ],
      "floors": [
        {
          "polygon": [
            { "x": -9, "z": 1 },
            { "x": -3, "z": 1 },
            { "x": -3, "z": 3 },
            { "x": -7, "z": 3 },
            { "x": -7, "z": 7 },
            { "x": -9, "z": 7 }
          ],
          "height": 3
        }
      ]
    },
    {
      "id": "ruin-l2",
      "kind": "ruin",
      "pos": { "x": 0, "z": 0 },
      "rot": 0,
      "footprint": [
        { "x": 9, "z": -1 },
        { "x": 3, "z": -1 },
        { "x": 3, "z": -3 },
        { "x": 7, "z": -3 },
        { "x": 7, "z": -7 },
        { "x": 9, "z": -7 }
      ],
      "height": 6,
      "traits": ["obscuring", "cover", "scalable"],
      "walls": [
        { "a": { "x": 9, "z": -1 }, "b": { "x": 3, "z": -1 }, "height": 6 },
        { "a": { "x": 3, "z": -1 }, "b": { "x": 3, "z": -3 }, "height": 6 },
        { "a": { "x": 3, "z": -3 }, "b": { "x": 7, "z": -3 }, "height": 6 },
        { "a": { "x": 7, "z": -3 }, "b": { "x": 7, "z": -7 }, "height": 6 },
        { "a": { "x": 7, "z": -7 }, "b": { "x": 9, "z": -7 }, "height": 6 },
        { "a": { "x": 9, "z": -7 }, "b": { "x": 9, "z": -1 }, "height": 6 }
      ],
      "floors": [
        {
          "polygon": [
            { "x": 9, "z": -1 },
            { "x": 3, "z": -1 },
            { "x": 3, "z": -3 },
            { "x": 7, "z": -3 },
            { "x": 7, "z": -7 },
            { "x": 9, "z": -7 }
          ],
          "height": 3
        }
      ]
    },
    {
      "id": "ruin-s1",
      "kind": "ruin",
      "pos": { "x": 0, "z": 0 },
      "rot": 0,
      "footprint": [
        { "x": -19, "z": -13 },
        { "x": -13, "z": -13 },
        { "x": -13, "z": -9 },
        { "x": -19, "z": -9 }
      ],
      "height": 4,
      "traits": ["obscuring", "cover"],
      "walls": [
        { "a": { "x": -19, "z": -13 }, "b": { "x": -13, "z": -13 }, "height": 4 },
        { "a": { "x": -13, "z": -13 }, "b": { "x": -13, "z": -9 }, "height": 4 },
        { "a": { "x": -13, "z": -9 }, "b": { "x": -19, "z": -9 }, "height": 4 },
        { "a": { "x": -19, "z": -9 }, "b": { "x": -19, "z": -13 }, "height": 4 }
      ]
    },
    {
      "id": "ruin-s2",
      "kind": "ruin",
      "pos": { "x": 0, "z": 0 },
      "rot": 0,
      "footprint": [
        { "x": 13, "z": 9 },
        { "x": 19, "z": 9 },
        { "x": 19, "z": 13 },
        { "x": 13, "z": 13 }
      ],
      "height": 4,
      "traits": ["obscuring", "cover"],
      "walls": [
        { "a": { "x": 13, "z": 9 }, "b": { "x": 19, "z": 9 }, "height": 4 },
        { "a": { "x": 19, "z": 9 }, "b": { "x": 19, "z": 13 }, "height": 4 },
        { "a": { "x": 19, "z": 13 }, "b": { "x": 13, "z": 13 }, "height": 4 },
        { "a": { "x": 13, "z": 13 }, "b": { "x": 13, "z": 9 }, "height": 4 }
      ]
    },
    {
      "id": "container-1",
      "kind": "crate",
      "pos": { "x": 0, "z": 0 },
      "rot": 0,
      "footprint": [
        { "x": 2, "z": -12 },
        { "x": 8, "z": -12 },
        { "x": 8, "z": -9 },
        { "x": 2, "z": -9 }
      ],
      "height": 3,
      "traits": ["cover", "scalable"],
      "floors": [
        {
          "polygon": [
            { "x": 2, "z": -12 },
            { "x": 8, "z": -12 },
            { "x": 8, "z": -9 },
            { "x": 2, "z": -9 }
          ],
          "height": 3
        }
      ]
    },
    {
      "id": "container-2",
      "kind": "crate",
      "pos": { "x": 0, "z": 0 },
      "rot": 0,
      "footprint": [
        { "x": -8, "z": 9 },
        { "x": -2, "z": 9 },
        { "x": -2, "z": 12 },
        { "x": -8, "z": 12 }
      ],
      "height": 3,
      "traits": ["cover", "scalable"],
      "floors": [
        {
          "polygon": [
            { "x": -8, "z": 9 },
            { "x": -2, "z": 9 },
            { "x": -2, "z": 12 },
            { "x": -8, "z": 12 }
          ],
          "height": 3
        }
      ]
    },
    {
      "id": "crater-1",
      "kind": "crater",
      "pos": { "x": 10, "z": 4 },
      "rot": 0,
      "footprint": [
        { "x": 2.5, "z": 0 },
        { "x": 2.31, "z": 0.96 },
        { "x": 1.77, "z": 1.77 },
        { "x": 0.96, "z": 2.31 },
        { "x": 0, "z": 2.5 },
        { "x": -0.96, "z": 2.31 },
        { "x": -1.77, "z": 1.77 },
        { "x": -2.31, "z": 0.96 },
        { "x": -2.5, "z": 0 },
        { "x": -2.31, "z": -0.96 },
        { "x": -1.77, "z": -1.77 },
        { "x": -0.96, "z": -2.31 },
        { "x": 0, "z": -2.5 },
        { "x": 0.96, "z": -2.31 },
        { "x": 1.77, "z": -1.77 },
        { "x": 2.31, "z": -0.96 }
      ],
      "height": 0.5,
      "traits": ["cover"]
    },
    {
      "id": "crater-2",
      "kind": "crater",
      "pos": { "x": -10, "z": -4 },
      "rot": 0,
      "footprint": [
        { "x": 2.5, "z": 0 },
        { "x": 2.31, "z": 0.96 },
        { "x": 1.77, "z": 1.77 },
        { "x": 0.96, "z": 2.31 },
        { "x": 0, "z": 2.5 },
        { "x": -0.96, "z": 2.31 },
        { "x": -1.77, "z": 1.77 },
        { "x": -2.31, "z": 0.96 },
        { "x": -2.5, "z": 0 },
        { "x": -2.31, "z": -0.96 },
        { "x": -1.77, "z": -1.77 },
        { "x": -0.96, "z": -2.31 },
        { "x": 0, "z": -2.5 },
        { "x": 0.96, "z": -2.31 },
        { "x": 1.77, "z": -1.77 },
        { "x": 2.31, "z": -0.96 }
      ],
      "height": 0.5,
      "traits": ["cover"]
    },
    {
      "id": "barricade-1",
      "kind": "barricade",
      "pos": { "x": 16, "z": -3 },
      "rot": 0,
      "footprint": [
        { "x": -2, "z": -0.25 },
        { "x": 2, "z": -0.25 },
        { "x": 2, "z": 0.25 },
        { "x": -2, "z": 0.25 }
      ],
      "height": 1.5,
      "traits": ["cover", "breachable"],
      "walls": [{ "a": { "x": -2, "z": 0 }, "b": { "x": 2, "z": 0 }, "height": 1.5, "thickness": 0.5 }]
    },
    {
      "id": "barricade-2",
      "kind": "barricade",
      "pos": { "x": -16, "z": 3 },
      "rot": 0,
      "footprint": [
        { "x": -2, "z": -0.25 },
        { "x": 2, "z": -0.25 },
        { "x": 2, "z": 0.25 },
        { "x": -2, "z": 0.25 }
      ],
      "height": 1.5,
      "traits": ["cover", "breachable"],
      "walls": [{ "a": { "x": -2, "z": 0 }, "b": { "x": 2, "z": 0 }, "height": 1.5, "thickness": 0.5 }]
    }
  ]
}
